### ISSUE TITLE
Not getting gzipped responses from Google's servers

### ISSUE THREAD

**Issue by jay0lee** [google/cups-connector#167]
While testing out some options for #166 , I noticed Google's HTTP servers are not sending us gzipped responses. Getting gzipped responses would reduce our bandwidth usage as well as increase performance. Looking at:
https://developers.google.com/discovery/v1/performance

the issue may be that we're sending "Accept-Encoding: gzip" but our User-Agent does not also have gzip in it.

**Comment by jay0lee** [comment]
Here's debug output. Note the accept-encoding and user-agent headers:

$ gcp-cups-connector-util --config-filename ~/cups-connector.config.json show-gcp-printer-status --printer-id bd095d1a-b37e-1410-492d-df24605057bf
POST /cloudprint/printer HTTP/1.1
Host: www.google.com
User-Agent: Go-http-client/1.1
Content-Length: 104
Content-Type: application/x-www-form-urlencoded
X-Cloudprint-Proxy: CUPS Connector DEV-linux
Accept-Encoding: gzip

extra_fields=queuedJobsCount%2CsemanticState&printerid=bd095d1a-b37e-1410-492d-df24605057bf&use_cdd=true

HTTP/1.1 200 OK
Transfer-Encoding: chunked
Cache-Control: private, max-age=0
Content-Type: text/plain
Date: Wed, 06 Jan 2016 13:24:18 GMT
Expires: Wed, 06 Jan 2016 13:24:18 GMT
P3p: CP="This is not a P3P policy! See https://support.google.com/accounts/answer/151657?hl=en for more info."
Server: GSE
Set-Cookie: NID=75=zI8ERQjIQ9c326KFISPBm09UFZWVHBBfeL_iErJjCwqWRzBrAWKxws0Fj_WjLG7uzmHvPrCAIt_m9e8DKkKalMwFVxhDiemBxmtGFb2Q1dJc_TyVoRt1jfYrpXv7WKbk;Domain=.google.com;Path=/;Expires=Thu, 07-Jul-2016 13:24:18 GMT;HttpOnly
X-Content-Type-Options: nosniff
X-Frame-Options: SAMEORIGIN
X-Xss-Protection: 1; mode=block

5bd9
{
 "success": true,
 "xsrf_token": "AIp06Dgxxay7v-R5ZVFVIhQf9BnEkOVIPA:1452086657996",
 "request": {
  "time": "0",
...
...

**Comment by jay0lee** [comment]
Further testing shows this is actually just net/http decompressing the gzip response and then removing the headers. If you change gcp_base_url in the config to http instead of https, you can see the full request on the wire with "tcpdump port http -s0 -A":

09:29:31.504999 IP home.jaylee.us.58466 > 55.32.199.65.philadelphia.google-ggc.verizon.com.http: Flags [P.], seq 426:789, ack 5691, win 329, options [nop,nop,TS val 188618654 ecr 3040659800], length 363: HTTP: POST /cloudprint/jobs HTTP/1.1
E...(.@.@.....V.A. 7.b.Pr.AVGD.....I.G.....
.>...<.XPOST /cloudprint/jobs HTTP/1.1
Host: www.google.com
User-Agent: Go-http-client/1.1
Content-Length: 46
Authorization: Bearer --SNIP--
Content-Type: application/x-www-form-urlencoded
X-Cloudprint-Proxy: CUPS Connector DEV-linux
Accept-Encoding: gzip

printerid=bd095d1a-b37e-1410-492d-df24605057bf
09:29:31.513418 IP 55.32.199.65.philadelphia.google-ggc.verizon.com.http > home.jaylee.us.58466: Flags [.], ack 789, win 243, options [nop,nop,TS val 3040659821 ecr 188618654], length 0
E..4.!..;.v.A. 7..V..P.bGD..r.B............
.<.m.>..
09:29:31.800643 IP 55.32.199.65.philadelphia.google-ggc.verizon.com.http > home.jaylee.us.58466: Flags [P.], seq 5691:6342, ack 789, win 243, options [nop,nop,TS val 3040660108 ecr 188618654], length 651: HTTP: HTTP/1.1 200 OK
E....\..;.t8A. 7..V..P.bGD..r.B.....N......
.<...>..HTTP/1.1 200 OK
Content-Type: text/plain
P3P: CP="This is not a P3P policy! See https://support.google.com/accounts/answer/151657?hl=en for more info."
**Content-Encoding: gzip**
Transfer-Encoding: chunked
Date: Wed, 06 Jan 2016 14:29:31 GMT
Expires: Wed, 06 Jan 2016 14:29:31 GMT
Cache-Control: private, max-age=0
X-Content-Type-Options: nosniff
X-Frame-Options: SAMEORIGIN
X-XSS-Protection: 1; mode=block
Server: GSE
Set-Cookie: NID=75=--SNIP--;Domain=.google.com;Path=/;Expires=Thu, 07-Jul-2016 14:29:31 GMT;HttpOnly
